{
  "schemaVersion": 1,
  "specVersion": "1.0",
  "repository": "tedczj/wecom-agent-bridge",
  "baselineCommit": "e7d7328c13b33f8e5feab4c1691350ed21dab2d2",
  "implementationStatus": "SPECIFICATION_ONLY_RUNNER_TO_BE_IMPLEMENTED",
  "frozenRules": {
    "rotationThresholdNumerator": 4,
    "rotationThresholdDenominator": 5,
    "predictFutureTokens": false,
    "rewriteUserQuery": false,
    "injectBusinessHistory": false,
    "bridgeReadRawAnswer": false
  },
  "globalAssertions": [
    "permissionScopeValid",
    "noBusinessReplayAfterUncertain",
    "rawQueryMatchesSourceRequest",
    "noBridgeRawAnswerDisclosure",
    "noProductionRemoteWrites"
  ],
  "cases": [
    {
      "id": "LIVE-00",
      "title": "运行时/模型/工具/usage 能力门禁",
      "suite": "probe",
      "evidenceTier": "LIVE_LOCAL",
      "status": "NOT_RUN",
      "repeat": 1,
      "requires": [
        "live-controller"
      ],
      "setup": [
        "使用专用空controller工作目录和专用测试scope；operator预配置已授权的模型认证，不由runner复制生产凭据。",
        "目标daily窗口为配置真实值1,000,000；Bridge/Route同profile且high。"
      ],
      "steps": [
        {
          "order": 1,
          "action": "probe",
          "detail": "记录git SHA、binary路径/version、配置hash、协议schema hash；读取可用model/config能力，不用LLM自报。"
        },
        {
          "order": 2,
          "action": "user",
          "detail": "只回复“能力探测完成”。"
        },
        {
          "order": 3,
          "action": "probe",
          "detail": "调用一个只读动态工具并恢复同一个controller thread；记录last usage、有效window和turnId。"
        },
        {
          "order": 4,
          "action": "probe",
          "detail": "验证仅allowlist工具可用；无shell/任意读文件/原生多agent；验证自动压缩不会由预测token触发。"
        }
      ],
      "assertions": [
        {
          "id": "LIVE-00-A01",
          "predicate": "capabilityReady",
          "expected": "所有管理运行所需能力均可用；缺项为BLOCKED且exit nonzero"
        },
        {
          "id": "LIVE-00-A02",
          "predicate": "modelProfileObserved",
          "expected": "Bridge与Route相同profile/high；requested与observed分开记录"
        },
        {
          "id": "LIVE-00-A03",
          "predicate": "usageBasis",
          "expected": "last-completed-request-total，不是累计total；window与配置相容"
        },
        {
          "id": "LIVE-00-A04",
          "predicate": "nativeRestoreIdentity",
          "expected": "resume后native ID相同"
        }
      ],
      "evidence": [
        "runtime-lock.json",
        "probe.json",
        "usage-event.json",
        "effective-tool-policy.json"
      ]
    },
    {
      "id": "LIVE-01",
      "title": "模糊称呼定位目录、惰性Route与daily默认",
      "suite": "core",
      "evidenceTier": "LIVE_LOCAL",
      "status": "NOT_RUN",
      "repeat": 3,
      "requires": [
        "live-controller",
        "live-business-codex"
      ],
      "setup": [
        "临时根/projects含wecom-agent-bridge、term4u、multi-lang-video-generator；元信息分别明确用途。",
        "初始无管理或业务session；没有目录模型覆盖。"
      ],
      "steps": [
        {
          "order": 1,
          "action": "user",
          "detail": "去那个做视频翻译配音的项目，只读检查项目说明，告诉我它做什么，不要改文件。"
        }
      ],
      "assertions": [
        {
          "id": "LIVE-01-A01",
          "predicate": "directoryIdentity",
          "expected": "multi-lang-video-generator"
        },
        {
          "id": "LIVE-01-A02",
          "predicate": "controllerCreationCount",
          "expected": "Bridge 1、目标Route 1；其他目录Route 0"
        },
        {
          "id": "LIVE-01-A03",
          "predicate": "businessSubmitCount",
          "expected": "1"
        },
        {
          "id": "LIVE-01-A04",
          "predicate": "modelDefaultSource",
          "expected": "daily且reasoning=high；三个角色配置记录正确"
        },
        {
          "id": "LIVE-01-A05",
          "predicate": "fixtureWrites",
          "expected": "业务project无变更"
        }
      ],
      "evidence": [
        "routing-decision.json",
        "session-bindings.json",
        "config-observation.json",
        "git-status.json"
      ]
    },
    {
      "id": "LIVE-02",
      "title": "目录保持与A→B→A的Route/业务绑定",
      "suite": "core",
      "evidenceTier": "LIVE_LOCAL",
      "status": "NOT_RUN",
      "repeat": 3,
      "requires": [
        "live-controller",
        "live-business-codex"
      ],
      "setup": [
        "A=term4u、B=doc-ocr-service；每目录有不同README。"
      ],
      "steps": [
        {
          "order": 1,
          "action": "user",
          "detail": "到 term4u，只读介绍这个项目。"
        },
        {
          "order": 2,
          "action": "user",
          "detail": "再看看另一个问题：只说明 README 的第一段，不要切项目。"
        },
        {
          "order": 3,
          "action": "user",
          "detail": "切到 doc-ocr-service，只读介绍它。"
        },
        {
          "order": 4,
          "action": "user",
          "detail": "切回 term4u，继续说明之前看到的内容。"
        }
      ],
      "assertions": [
        {
          "id": "LIVE-02-A01",
          "predicate": "directorySequence",
          "expected": "A,A,B,A"
        },
        {
          "id": "LIVE-02-A02",
          "predicate": "routeSessionIdentity",
          "expected": "A两次往返始终复用同一个Route native ID；B不同"
        },
        {
          "id": "LIVE-02-A03",
          "predicate": "businessSessionIdentity",
          "expected": "最后一轮复用A初次业务native ID；不是B的或新建的"
        },
        {
          "id": "LIVE-02-A04",
          "predicate": "queryByteIdentity",
          "expected": "全部实际下游文本等于各自原始query"
        }
      ],
      "evidence": [
        "per-turn-routing.json",
        "native-session-ids.json",
        "adapter-input-hashes.json"
      ]
    },
    {
      "id": "LIVE-03",
      "title": "只透传“继续”验证原生业务上下文",
      "suite": "core",
      "evidenceTier": "LIVE_LOCAL",
      "status": "NOT_RUN",
      "repeat": 3,
      "requires": [
        "live-controller",
        "live-business-codex"
      ],
      "setup": [
        "A已授权；runner生成本次随机nonce，放入第一条query，第二条不含nonce。"
      ],
      "steps": [
        {
          "order": 1,
          "action": "user",
          "detail": "在 term4u 开始一个会话。记住本次校验词 ${nonce}，后续问你时再回答；现在只回复“已记住”，不要写入项目文件。"
        },
        {
          "order": 2,
          "action": "user",
          "detail": "继续，只回复刚才的校验词。"
        }
      ],
      "assertions": [
        {
          "id": "LIVE-03-A01",
          "predicate": "sameNativeSession",
          "expected": "两轮业务native session完全相同"
        },
        {
          "id": "LIVE-03-A02",
          "predicate": "queryByteIdentity",
          "expected": "第二轮业务prompt只有第二条query，不含nonce/recap/历史拼接"
        },
        {
          "id": "LIVE-03-A03",
          "predicate": "answerEquals",
          "expected": "第二轮答案去掉展示包装后为本次nonce"
        },
        {
          "id": "LIVE-03-A04",
          "predicate": "nativeTurnContinuity",
          "expected": "第二轮确实发生在第一轮之后，原生历史含第一轮输入"
        }
      ],
      "evidence": [
        "adapter-inputs.private.jsonl",
        "native-id-timeline.json",
        "answer-hashes.json"
      ]
    },
    {
      "id": "LIVE-04",
      "title": "明确新建与旧会话隔离",
      "suite": "core",
      "evidenceTier": "LIVE_LOCAL",
      "status": "NOT_RUN",
      "repeat": 3,
      "requires": [
        "live-controller",
        "live-business-codex"
      ],
      "setup": [
        "沿用同case内一段包含随机nonce的旧业务session；目录保持不变。"
      ],
      "steps": [
        {
          "order": 1,
          "action": "user",
          "detail": "在 term4u 记住口令 ${nonce}，只回复记住了。"
        },
        {
          "order": 2,
          "action": "user",
          "detail": "在当前目录开个新会话，不要之前的聊天上下文，只回复新会话已开始。"
        },
        {
          "order": 3,
          "action": "user",
          "detail": "现在只判断你在本会话是否收到过我给的随机口令，不要猜具体值。"
        }
      ],
      "assertions": [
        {
          "id": "LIVE-04-A01",
          "predicate": "differentNativeSession",
          "expected": "第二轮业务session与第一轮不同；Route不因业务new而新建"
        },
        {
          "id": "LIVE-04-A02",
          "predicate": "queryByteIdentity",
          "expected": "新session输入未带旧nonce/recap"
        },
        {
          "id": "LIVE-04-A03",
          "predicate": "secretAbsentFromContext",
          "expected": "新业务session的native输入没有旧nonce"
        },
        {
          "id": "LIVE-04-A04",
          "predicate": "newSessionResponse",
          "expected": "不声称知道旧nonce"
        }
      ],
      "evidence": [
        "native-session-ids.json",
        "adapter-inputs.private.jsonl",
        "new-native-input-audit.json"
      ]
    },
    {
      "id": "LIVE-05",
      "title": "业务模型显式覆盖不污染管理层",
      "suite": "core",
      "evidenceTier": "LIVE_LOCAL",
      "status": "NOT_RUN",
      "repeat": 3,
      "requires": [
        "live-controller",
        "live-business-codex"
      ],
      "setup": [
        "真实配置另一个可用business模型profile alternate；没有替代模型时BLOCKED不能用同ID冒充。",
        "两个profile均有明确runtime capability证明。"
      ],
      "steps": [
        {
          "order": 1,
          "action": "user",
          "detail": "到 term4u，这一轮业务任务使用 ${alternateLabel}，只输出 README 标题，不改文件。"
        },
        {
          "order": 2,
          "action": "user",
          "detail": "去 doc-ocr-service，只输出项目名称。"
        }
      ],
      "assertions": [
        {
          "id": "LIVE-05-A01",
          "predicate": "modelOverrideScope",
          "expected": "第一轮业务用alternate；Bridge/Route仍daily/high"
        },
        {
          "id": "LIVE-05-A02",
          "predicate": "defaultFallbackOnlyWhenUnspecified",
          "expected": "B业务无覆盖时使用daily；不可因模型错误fallback"
        },
        {
          "id": "LIVE-05-A03",
          "predicate": "profileDigestAndSource",
          "expected": "保存请求覆盖来源和生效digest，不只记录请求参数"
        }
      ],
      "evidence": [
        "model-observations.json",
        "profile-resolution.json",
        "native-turn-context.json"
      ]
    },
    {
      "id": "LIVE-06",
      "title": "本次事故回归：查A进度后在A分批commit/push",
      "suite": "core",
      "evidenceTier": "LIVE_LOCAL",
      "status": "NOT_RUN",
      "repeat": 3,
      "requires": [
        "live-controller",